<?xml version="1.0" encoding="UTF-8"?>
<dataroot xmlns:od="urn:schemas-microsoft-com:officedata" xmlns:xsi="http://www.w3.org/2001/XMLSchema-instance"  xsi:noNamespaceSchemaLocation="Card.xsd" generated="2017-04-20T15:35:25">
<Card1>
<ID>1</ID>
<GivenID>0</GivenID>
<Desc>Card Desc0</Desc>
<NPCID>0</NPCID>
</Card1>
<Card1>
<ID>2</ID>
<GivenID>1</GivenID>
<Desc>Card Desc1</Desc>
<NPCID>1</NPCID>
</Card1>
<Card1>
<ID>3</ID>
<GivenID>2</GivenID>
<Desc>Card Desc2</Desc>
<NPCID>0</NPCID>
</Card1>
<Card1>
<ID>4</ID>
<GivenID>3</GivenID>
<Desc>Card Desc3</Desc>
<NPCID>1</NPCID>
</Card1>
<Card1>
<ID>5</ID>
<GivenID>4</GivenID>
<Desc>Card Desc4</Desc>
<NPCID>0</NPCID>
</Card1>
<Card1>
<ID>6</ID>
<GivenID>5</GivenID>
<Desc>Card Desc5</Desc>
<NPCID>1</NPCID>
</Card1>
<Card1>
<ID>7</ID>
<GivenID>6</GivenID>
<Desc>Card Desc6</Desc>
<NPCID>0</NPCID>
</Card1>
<Card1>
<ID>8</ID>
<GivenID>7</GivenID>
<Desc>Card Desc7</Desc>
<NPCID>1</NPCID>
</Card1>
<Card1>
<ID>9</ID>
<GivenID>8</GivenID>
<Desc>Card Desc8</Desc>
<NPCID>0</NPCID>
</Card1>
<Card1>
<ID>10</ID>
<GivenID>9</GivenID>
<Desc>Card Desc9</Desc>
<NPCID>1</NPCID>
</Card1>
<Card1>
<ID>11</ID>
<GivenID>10</GivenID>
<Desc>Card Desc10</Desc>
<NPCID>0</NPCID>
</Card1>
</dataroot>
